,author,text,line,expected,result
820,homer,iliad,αὐτὰρ Ἀθήνηδῦν Ἄϊδος κυνέην μή μιν ἴδοι ὄβριμος Ἄρης,0,0
821,homer,iliad,δεύτερος αὖθ ὡρμᾶτο βοὴν ἀγαθὸς Διομήδηςἔγχεϊ χαλκείῳ,0,0
822,homer,iliad,σὺ γὰρ τέκες ἄφρονα κούρηνοὐλομένην ᾗ τ αἰὲν ἀήσυλα ἔργα μέμηλεν,0,0
823,homer,iliad,ἐκ γὰρ ἐμεῦ γένος ἐσσί ἐμοὶ δέ σε γείνατο μήτηρ,0,0
824,homer,iliad,τὸν δὲ σκότος ὄσσε κάλυψεν,0,0
825,homer,iliad,Πιδύτην δ Ὀδυσεὺς Περκώσιον ἐξενάριξενἔγχεϊ χαλκείῳ Τεῦκρος δ Ἀρετάονα δῖον,0,0
826,homer,iliad,ὣς εἰπὼν ὄτρυνε μένος καὶ θυμὸν ἑκάστου,0,0
827,homer,iliad,ἐννῆμαρ ξείνισσε καὶ ἐννέα βοῦς ἱέρευσεν,0,0
828,homer,iliad,ἀλλ ὅτε δὴ δεκάτη ἐφάνη ῥοδοδάκτυλος Ἠὼςκαὶ τότε μιν ἐρέεινε καὶ ᾔτεε σῆμα ἰδέσθαιὅττί ῥά οἱ γαμβροῖο πάρα Προίτοιο φέροιτο,0,0
829,homer,iliad,ὣς φάτο γήθησεν δὲ βοὴν ἀγαθὸς Διομήδης,0,0
830,homer,iliad,αὐτὰρ ἐν αὐτῷπεντήκοντ ἔνεσαν θάλαμοι ξεστοῖο λίθοιοπλησίον ἀλλήλων δεδμημένοι ἔνθα δὲ παῖδεςκοιμῶντο Πριάμοιο παρὰ μνηστῇς ἀλόχοισικουράων δ ἑτέρωθεν ἐναντίοι ἔνδοθεν αὐλῆςδώδεκ ἔσαν τέγεοι θάλαμοι ξεστοῖο λίθοιοπλησίον ἀλλήλων δεδμημένοι ἔνθα δὲ γαμβροὶκοιμῶντο Πριάμοιο παρ αἰδοίῃς ἀλόχοισιν,0,0
831,homer,iliad,ἀλλὰ σὺ μὲν πρὸς νηὸν Ἀθηναίης ἀγελείηςἔρχευ ἐγὼ δὲ Πάριν μετελεύσομαι ὄφρα καλέσσωαἴ κ ἐθέλῃσ εἰπόντος ἀκουέμεν,0,0
832,homer,iliad,πότνι Ἀθηναίη ἐρυσίπτολι δῖα θεάωνἆξον δὴ ἔγχος Διομήδεος ἠδὲ καὶ αὐτὸνπρηνέα δὸς πεσέειν Σκαιῶν προπάροιθε πυλάωνὄφρά τοι αὐτίκα νῦν δυοκαίδεκα βοῦς ἐνὶ νηῷἤνις ἠκέστας ἱερεύσομεν αἴ κ ἐλεήσῃςἄστύ τε καὶ Τρώων ἀλόχους καὶ νήπια τέκνα,0,0
833,homer,iliad,τὸν δ Ἕκτωρ νείκεσσεν ἰδὼν αἰσχροῖς ἐπέεσσι,0,0
834,homer,iliad,δοκέει δέ μοι ὧδε καὶ αὐτῷλώϊον ἔσσεσθαι,0,0
835,homer,iliad,ἤτοι ὃ μὲν μείδησεν ἰδὼν ἐς παῖδα σιωπῇ,0,0
836,homer,iliad,ἤτοι γὰρ πατέρ ἁμὸν ἀπέκτανε δῖος Ἀχιλλεύςἐκ δὲ πόλιν πέρσεν Κιλίκων εὖ ναιετάουσανΘήβην ὑψίπυλον,0,0
837,homer,iliad,αἶψα δ ἔπειθ ἵκανε δόμους εὖ ναιετάονταςἝκτορος ἀνδροφόνοιο κιχήσατο δ ἔνδοθι πολλὰςἀμφιπόλους τῇσιν δὲ γόον πάσῃσιν ἐνῶρσεν,0,0
838,homer,iliad,ὃ δ ἀγλαΐηφι πεποιθὼςῥίμφά ἑ γοῦνα φέρει μετά τ ἤθεα καὶ νομὸν ἵππων,0,0
839,homer,iliad,τὰ δ ὄπισθεν ἀρεσσόμεθ αἴ κέ ποθι Ζεὺςδώῃ ἐπουρανίοισι θεοῖς αἰειγενέτῃσικρητῆρα στήσασθαι ἐλεύθερον ἐν μεγάροισινἐκ Τροίης ἐλάσαντας ἐϋκνήμιδας Ἀχαιούς,0,0
840,homer,iliad,τῇ δ ἀντίος ὄρνυτ ἈπόλλωνΠεργάμου ἐκκατιδών Τρώεσσι δὲ βούλετο νίκην,0,0
841,homer,iliad,ὣς γὰρ ἐγὼ ὄπ ἄκουσα θεῶν αἰειγενετάων,0,0
842,homer,iliad,κὰδ δ ἄρ Ἀθηναίη τε καὶ ἀργυρότοξος Ἀπόλλωνἑζέσθην ὄρνισιν ἐοικότες αἰγυπιοῖσιφηγῷ ἐφ ὑψηλῇ πατρὸς Διὸς αἰγιόχοιοἀνδράσι τερπόμενοι,0,0
843,homer,iliad,ἀλλὰ σὺ μὲν νῦν ἵζευ ἰὼν μετὰ ἔθνος ἑταίρωντούτῳ δὲ πρόμον ἄλλον ἀναστήσουσιν Ἀχαιοί,0,0
844,homer,iliad,εἴθ ὣς ἡβώοιμι βίη δέ μοι ἔμπεδος εἴη,0,0
845,homer,iliad,τὸν δὲ καὶ Ἀργεῖοι μὲν ἐγήθεον εἰσορόωντεςΤρῶας δὲ τρόμος αἰνὸς ὑπήλυθε γυῖα ἕκαστονἝκτορί τ αὐτῷ θυμὸς ἐνὶ στήθεσσι πάτασσεν,0,0
846,homer,iliad,ἡμεῖς δ εἰμὲν τοῖοι οἳ ἂν σέθεν ἀντιάσαιμενκαὶ πολέες,0,0
847,homer,iliad,οἶδα δ ἐνὶ σταδίῃ δηΐῳ μέλπεσθαι Ἄρηϊ,0,0
848,homer,iliad,δεύτερος αὖτ Αἴας πολὺ μείζονα λᾶαν ἀείραςἧκ ἐπιδινήσας ἐπέρεισε δὲ ἶν ἀπέλεθρονεἴσω δ ἀσπίδ ἔαξε βαλὼν μυλοειδέϊ πέτρῳβλάψε δέ οἱ φίλα γούναθ,0,0
849,homer,iliad,οἶσθα καὶ ἄλλον μῦθον ἀμείνονα τοῦδε νοῆσαι,0,0
850,homer,iliad,αὐτὰρ ἐγὼ Τρώεσσι μεθ ἱπποδάμοις ἀγορεύσω,0,0
851,homer,iliad,ἠῶθεν δ Ἰδαῖος ἔβη κοίλας ἐπὶ νῆας,0,0
852,homer,iliad,ὀψὲ δὲ δὴ μετέειπε βοὴν ἀγαθὸς Διομήδης,0,0
853,homer,iliad,σὸν δ ἤτοι κλέος ἔσται ὅσον τ ἐπικίδναται ἠώς,0,0
854,homer,iliad,ἀλλ οὐκ ἂν ἐρύσαιτ ἐξ οὐρανόθεν πεδίον δὲΖῆν ὕπατον μήστωρ οὐδ εἰ μάλα πολλὰ κάμοιτε,0,0
855,homer,iliad,ἀλλ ἔμπης Δαναῶν ὀλοφυρόμεθ αἰχμητάωνοἵ κεν δὴ κακὸν οἶτον ἀναπλήσαντες ὄλωνται,0,0
856,homer,iliad,θάρσει Τριτογένεια φίλον τέκος,0,0
857,homer,iliad,οἳ δ ἄρα δεῖπνον ἕλοντο κάρη κομόωντες Ἀχαιοὶῥίμφα κατὰ κλισίας ἀπὸ δ αὐτοῦ θωρήσσοντο,0,0
858,homer,iliad,Ἕκτορα δ αἰνὸν ἄχος πύκασε φρένας ἡνιόχοιο,0,0
859,homer,iliad,ἐπὶ δὲ Τρῶές τε καὶ Ἕκτωρἠχῇ θεσπεσίῃ βέλεα στονόεντα χέοντο,0,0
860,homer,iliad,Τεῦκρος δ εἴνατος ἦλθε παλίντονα τόξα τιταίνωνστῆ δ ἄρ ὑπ Αἴαντος σάκεϊ Τελαμωνιάδαο,0,0
861,homer,iliad,τὸν δὲ ἰδὼν γήθησεν ἄναξ ἀνδρῶν Ἀγαμέμνωντόξου ἄπο κρατεροῦ Τρώων ὀλέκοντα φάλαγγας,0,0
862,homer,iliad,Ἥρῃ δ οὐκ ἔχαδε στῆθος χόλον ἀλλὰ προσηύδα,0,0
863,homer,iliad,πάροιθε δὲ λάμπετο δουρὸςαἰχμὴ χαλκείη περὶ δὲ χρύσεος θέε πόρκηςτῷ ὅ γ ἐρεισάμενος ἔπεα Τρώεσσι μετηύδα,0,0
864,homer,iliad,οἳ δ ἵππους μὲν λῦσαν ὑπὸ ζυγοῦ ἱδρώονταςδῆσαν δ ἱμάντεσσι παρ ἅρμασιν οἷσιν ἕκαστος,0,0
865,homer,iliad,ἀτὰρ πεπνυμένα βάζειςἈργείων βασιλῆας ἐπεὶ κατὰ μοῖραν ἔειπες,0,0
866,homer,iliad,μάλα γάρ τοι ἔγωγεπόλλ ἀπεμυθεόμην,0,0
867,homer,iliad,τρεῖς δέ μοί εἰσι θύγατρες ἐνὶ μεγάρῳ εὐπήκτῳΧρυσόθεμις καὶ Λαοδίκη καὶ Ἰφιάνασσατάων ἥν κ ἐθέλῃσι φίλην ἀνάεδνον ἀγέσθωπρὸς οἶκον Πηλῆος,0,0
868,homer,iliad,τὼ δὲ βάτην παρὰ θῖνα πολυφλοίσβοιο θαλάσσηςπολλὰ μάλ εὐχομένω γαιηόχῳ ἐννοσιγαίῳῥηϊδίως πεπιθεῖν μεγάλας φρένας Αἰακίδαο,0,0
869,homer,iliad,ὃ δ Ἀχαιῶν ἄλλον ἑλέσθωὅς τις οἷ τ ἐπέοικε καὶ ὃς βασιλεύτερός ἐστιν,0,0
870,homer,iliad,εἰ μέν κ αὖθι μένων Τρώων πόλιν ἀμφιμάχωμαιὤλετο μέν μοι νόστος ἀτὰρ κλέος ἄφθιτον ἔσται,0,0
871,homer,iliad,τοὔνεκά με προέηκε διδασκέμεναι τάδε πάνταμύθων τε ῥητῆρ ἔμεναι πρηκτῆρά τε ἔργων,0,0
872,homer,iliad,ὡς ἂν ἔπειτ ἀπὸ σεῖο φίλον τέκος οὐκ ἐθέλοιμιλείπεσθ οὐδ εἴ κέν μοι ὑποσταίη θεὸς αὐτὸςγῆρας ἀποξύσας θήσειν νέον ἡβώονταοἷον ὅτε πρῶτον λίπον Ἑλλάδα καλλιγύναικαφεύγων νείκεα πατρὸς Ἀμύντορος Ὀρμενίδαοὅς μοι παλλακίδος περιχώσατο καλλικόμοιοτὴν αὐτὸς φιλέεσκεν ἀτιμάζεσκε δ ἄκοιτινμητέρ ἐμήν,0,0
873,homer,iliad,ὣς ἐπὶ σοὶ μάλα πολλὰ πάθον καὶ πολλὰ μόγησατὰ φρονέων ὅ μοι οὔ τι θεοὶ γόνον ἐξετέλειονἐξ ἐμεῦ,0,0
874,homer,iliad,οὐδέ τί σε χρὴνηλεὲς ἦτορ ἔχειν,0,0
875,homer,iliad,ἣ δὲ χολωσαμένη δῖον γένος ἰοχέαιραὦρσεν ἔπι χλούνην σῦν ἄγριον ἀργιόδονταὃς κακὰ πόλλ ἕρδεσκεν ἔθων Οἰνῆος ἀλωήν,0,0
876,homer,iliad,αὐτὸς δ ἠπείλησεν ἅμ ἠοῖ φαινομένηφινῆας ἐϋσσέλμους ἅλαδ ἑλκέμεν ἀμφιελίσσας,0,0
877,homer,iliad,ὃ δ ἀγήνωρ ἐστὶ καὶ ἄλλως,0,1
878,homer,iliad,τίφθ οὕτως ἠθεῖε κορύσσεαι,0,0
879,homer,iliad,φθέγγεο δ ᾗ κεν ἴῃσθα καὶ ἐγρήγορθαι ἄνωχθιπατρόθεν ἐκ γενεῆς ὀνομάζων ἄνδρα ἕκαστονπάντας κυδαίνων,0,0
880,homer,iliad,τὸν δ ἠμείβετ ἔπειτα Γερήνιος ἱππότα Νέστωρ,0,0
881,homer,iliad,πολλάκι γὰρ μεθιεῖ τε καὶ οὐκ ἐθέλει πονέεσθαιοὔτ ὄκνῳ εἴκων οὔτ ἀφραδίῃσι νόοιοἀλλ ἐμέ τ εἰσορόων καὶ ἐμὴν ποτιδέγμενος ὁρμήν,0,0
882,homer,iliad,αὐτὰρ ὅ γ ἥρωςεὗδ ὑπὸ δ ἔστρωτο ῥινὸν βοὸς ἀγραύλοιοαὐτὰρ ὑπὸ κράτεσφι τάπης τετάνυστο φαεινός,0,0
883,homer,iliad,οὐκ ἀΐεις ὡς Τρῶες ἐπὶ θρωσμῷ πεδίοιοεἵαται ἄγχι νεῶν ὀλίγος δ ἔτι χῶρος ἐρύκει,0,0
884,homer,iliad,νῦν γὰρ δὴ πάντεσσιν ἐπὶ ξυροῦ ἵσταται ἀκμῆςἢ μάλα λυγρὸς ὄλεθρος Ἀχαιοῖς ἠὲ βιῶναι,0,0
885,homer,iliad,βῆ δ ἰέναι τοὺς δ ἔνθεν ἀναστήσας ἄγεν ἥρως,0,0
886,homer,iliad,μέγα κέν οἱ ὑπουράνιον κλέος εἴηπάντας ἐπ ἀνθρώπους καί οἱ δόσις ἔσσεται ἐσθλή,0,0
887,homer,iliad,ἀλλ εἴ τίς μοι ἀνὴρ ἅμ ἕποιτο καὶ ἄλλοςμᾶλλον θαλπωρὴ καὶ θαρσαλεώτερον ἔσται,0,0
888,homer,iliad,ἠθελέτην Αἴαντε δύω θεράποντες Ἄρηοςἤθελε Μηριόνης μάλα δ ἤθελε Νέστορος υἱόςἤθελε δ Ἀτρεΐδης δουρικλειτὸς Μενέλαοςἤθελε δ ὁ τλήμων Ὀδυσεὺς καταδῦναι ὅμιλονΤρώων,0,0
889,homer,iliad,τοῖς δ αὖτις μετέειπε βοὴν ἀγαθὸς Διομήδης,0,0
890,homer,iliad,Ἀμφιδάμας δὲ Μόλῳ δῶκε ξεινήϊον εἶναιαὐτὰρ ὃ Μηριόνῃ δῶκεν ᾧ παιδὶ φορῆναι,0,0
891,homer,iliad,τοῖσι δὲ δεξιὸν ἧκεν ἐρῳδιὸν ἐγγὺς ὁδοῖοΠαλλὰς Ἀθηναίη,0,1
892,homer,iliad,χαῖρε δὲ τῷ ὄρνιθ Ὀδυσεύς ἠρᾶτο δ Ἀθήνῃ,0,0
893,homer,iliad,ἀτὰρ ἂψ ἀπιὼν μάλα μέρμερα μήσατο ἔργασὺν σοὶ δῖα θεά ὅτε οἱ πρόφρασσα παρέστης,0,0
894,homer,iliad,οὐδ ἄρ ἔμελλενἐλθὼν ἐκ νηῶν ἂψ Ἕκτορι μῦθον ἀποίσειν,0,0
895,homer,iliad,ἀλλ ἄγε μοι τόδε εἰπὲ καὶ ἀτρεκέως κατάλεξον,0,0
896,homer,iliad,δίειπέ μοι ὄφρα δαείω,0,0
897,homer,iliad,παρὰ δέ σφιν ἑκάστῳ δίζυγες ἵπποι,0,0
898,homer,iliad,ὡς δὲ λέων μήλοισιν ἀσημάντοισιν ἐπελθὼναἴγεσιν ἢ ὀΐεσσι κακὰ φρονέων ἐνορούσῃὣς μὲν Θρήϊκας ἄνδρας ἐπῴχετο Τυδέος υἱὸςὄφρα δυώδεκ ἔπεφνεν,0,0
899,homer,iliad,εἷος ὃ ταῦθ ὥρμαινε κατὰ φρένα τόφρα δ Ἀθήνηἐγγύθεν ἱσταμένη προσέφη Διομήδεα δῖον,0,0
900,homer,iliad,Τρώων δὲ κλαγγή τε καὶ ἄσπετος ὦρτο κυδοιμὸςθυνόντων ἄμυδις,0,0
901,homer,iliad,αὐτὴν γάρ μιν ὑπὸ τρόμος αἰνὸς ἱκάνει,0,0
902,homer,iliad,ὃ δ ὅθι πλεῖσται κλονέοντο φάλαγγεςτῇ ῥ ἐνόρουσ ἅμα δ ἄλλοι ἐϋκνήμιδες Ἀχαιοί,0,0
903,homer,iliad,οὐδ ἔτορε ζωστῆρα παναίολον ἀλλὰ πολὺ πρὶνἀργύρῳ ἀντομένη μόλιβος ὣς ἐτράπετ αἰχμή,0,0
904,homer,iliad,τὸν δ ἄορι πλῆξ αὐχένα λῦσε δὲ γυῖα,0,0
905,homer,iliad,τοῖο δ ἐπ Ἰφιδάμαντι κάρη ἀπέκοψε παραστάς,0,0
906,homer,iliad,ὡς δ ὅτ ἂν ὠδίνουσαν ἔχῃ βέλος ὀξὺ γυναῖκαδριμύ τό τε προϊεῖσι μογοστόκοι ΕἰλείθυιαιἭρης θυγατέρες πικρὰς ὠδῖνας ἔχουσαιὣς ὀξεῖ ὀδύναι δῦνον μένος Ἀτρεΐδαο,0,0
907,homer,iliad,Ἕκτωρ δ ὡς ἐνόησ Ἀγαμέμνονα νόσφι κιόνταΤρωσί τε καὶ Λυκίοισιν ἐκέκλετο μακρὸν ἀΰσας,0,0
908,homer,iliad,Τυδεΐδη τί παθόντε λελάσμεθα θούριδος ἀλκῆς,0,0
909,homer,iliad,ἀλλὰ μίνυνθαἡμέων ἔσσεται ἦδος ἐπεὶ νεφεληγερέτα ΖεὺςΤρωσὶν δὴ βόλεται δοῦναι κράτος ἠέ περ ἡμῖν,0,0
910,homer,iliad,ἔνθ ἑλέτην δίφρόν τε καὶ ἀνέρε δήμου ἀρίστωυἷε δύω Μέροπος Περκωσίου ὃς περὶ πάντωνᾔδεε μαντοσύνας οὐδὲ οὓς παῖδας ἔασκεστείχειν ἐς πόλεμον φθισήνορα,0,0
911,homer,iliad,ὤ μοι ἐγὼ τί πάθω,0,0
912,homer,iliad,Τρῶες δὲ διέτρεσαν ἄλλυδις ἄλλος,0,0
913,homer,iliad,αἵματι δ ἄξωννέρθεν ἅπας πεπάλακτο καὶ ἄντυγες αἳ περὶ δίφρονἃς ἄρ ἀφ ἱππείων ὁπλέων ῥαθάμιγγες ἔβαλλοναἵ τ ἀπ ἐπισσώτρων,0,0
914,homer,iliad,ὣς τότ ἔπειτ Αἴαντα μέγαν Τελαμώνιον υἱὸνΤρῶες ὑπέρθυμοι πολυηγερέες τ ἐπίκουροινύσσοντες ξυστοῖσι μέσον σάκος αἰὲν ἕποντο,0,0
915,homer,iliad,τὸν δ ὡς οὖν ἐνόησ Εὐαίμονος ἀγλαὸς υἱὸςΕὐρύπυλος πυκινοῖσι βιαζόμενον βελέεσσιστῆ ῥα παρ αὐτὸν ἰών καὶ ἀκόντισε δουρὶ φαεινῷκαὶ βάλε Φαυσιάδην Ἀπισάονα ποιμένα λαῶνἧπαρ ὑπὸ πραπίδων εἶθαρ δ ὑπὸ γούνατ ἔλυσεν,0,0
916,homer,iliad,στῆ δὲ μεταστρεφθείς ἐπεὶ ἵκετο ἔθνος ἑταίρων,0,0
917,homer,iliad,τὰ δ ἄλλ ἐς δῆμον ἔδωκεδαιτρεύειν μή τίς οἱ ἀτεμβόμενος κίοι ἴσης,0,0
918,homer,iliad,τίς δ οἶδ εἴ κέν οἱ σὺν δαίμονι θυμὸν ὀρίναιςπαρειπών,0,0
919,homer,iliad,ὣς ἔφατ οὐδὲ Διὸς πεῖθε φρένα ταῦτ ἀγορεύων,0,0
920,homer,iliad,αὐτὰρ Ἀχαιῶνθέλγε νόον Τρωσὶν δὲ καὶ Ἕκτορι κῦδος ὄπαζε,0,0
921,homer,iliad,τὰς οἵ γ αὐέρυον ἔλποντο δὲ τεῖχος Ἀχαιῶνῥήξειν,0,1
922,homer,iliad,ὣς τῶν ἀμφοτέρωσε λίθοι πωτῶντο θαμειαίαἱ μὲν ἄρ ἐς Τρῶας αἱ δ ἐκ Τρώων ἐς Ἀχαιούςβαλλομένων,0,0
923,homer,iliad,ὣς ἔφατ οὐδὲ Γλαῦκος ἀπετράπετ οὐδ ἀπίθησε,0,0
924,homer,iliad,ὣς ἔφατ οὐδ ἄρα οἱ κῆρυξ ἀπίθησεν ἀκούσαςβῆ δὲ θέειν παρὰ τεῖχος Ἀχαιῶν χαλκοχιτώνωνστῆ δὲ παρ Αἰάντεσσι κιών εἶθαρ δὲ προσηύδα,0,0
925,homer,iliad,πάντῃ δὴ πύργοι καὶ ἐπάλξιες αἵματι φωτῶνἐρράδατ ἀμφοτέρωθεν ἀπὸ Τρώων καὶ Ἀχαιῶν,0,0
926,homer,iliad,οἳ μὲν ἔπειτακροσσάων ἐπέβαινον ἀκαχμένα δούρατ ἔχοντεςἝκτωρ δ ἁρπάξας λᾶαν φέρεν ὅς ῥα πυλάωνἑστήκει πρόσθε πρυμνὸς παχύς αὐτὰρ ὕπερθενὀξὺς ἔην,0,0
927,homer,iliad,ὡς δ ὅτε ποιμὴν ῥεῖα φέρει πόκον ἄρσενος οἰὸςχειρὶ λαβὼν ἑτέρῃ ὀλίγον τέ μιν ἄχθος ἐπείγειὣς Ἕκτωρ ἰθὺς σανίδων φέρε λᾶαν ἀείραςαἵ ῥα πύλας εἴρυντο πύκα στιβαρῶς ἀραρυίαςδικλίδας ὑψηλάς,0,0
928,homer,iliad,τῇ δὲ δὴ αἰνότατον περιδείδια μή τι πάθωμενᾗ ῥ ὅ γ ὁ λυσσώδης φλογὶ εἴκελος ἡγεμονεύειἝκτωρ ὃς Διὸς εὔχετ ἐρισθενέος πάϊς εἶναι,0,0
929,homer,iliad,αὐτὸς δ ὥς τ ἴρηξ ὠκύπτερος ὦρτο πέτεσθαιὅς ῥά τ ἀπ αἰγίλιπος πέτρης περιμήκεος ἀρθεὶςὁρμήσῃ πεδίοιο διώκειν ὄρνεον ἄλλοὣς ἀπὸ τῶν ἤϊξε Ποσειδάων ἐνοσίχθων,0,0
930,homer,iliad,ἀλλ ἐνοσίχθωνῥεῖα μετεισάμενος κρατερὰς ὄτρυνε φάλαγγας,0,0
931,homer,iliad,εἰ δ ὑμεῖς πολέμοιο μεθήσετε λευγαλέοιονῦν δὴ εἴδεται ἦμαρ ὑπὸ Τρώεσσι δαμῆναι,0,0
932,homer,iliad,ἀμφὶ δ ἄρ Αἴαντας δοιοὺς ἵσταντο φάλαγγεςκαρτεραί ἃς οὔτ ἄν κεν Ἄρης ὀνόσαιτο μετελθὼνοὔτε κ Ἀθηναίη λαοσσόος,0,0
933,homer,iliad,ἤϋσεν δὲ διαπρύσιον Τρώεσσι γεγωνώς,0,0
934,homer,iliad,τῆς δ οὔ τι διήλασεν ἀλλὰ πολὺ πρὶνἐν καυλῷ ἐάγη δολιχὸν δόρυ,0,0
935,homer,iliad,τόν ῥ υἱὸς Τελαμῶνος ὑπ οὔατος ἔγχεϊ μακρῷνύξ ἐκ δ ἔσπασεν ἔγχος,0,0
936,homer,iliad,Ἕκτωρ δ ὁρμηθέντος ἀκόντισε δουρὶ φαεινῷ,0,0
937,homer,iliad,Ἰδομενεῦ Κρητῶν βουληφόρε ποῦ τοι ἀπειλαὶοἴχονται τὰς Τρωσὶν ἀπείλεον υἷες Ἀχαιῶν,0,0
938,homer,iliad,οὔτέ τινα δέος ἴσχει ἀκήριον οὔτέ τις ὄκνῳεἴκων ἀνδύεται πόλεμον κακόν,0,0
939,homer,iliad,Ἰδομενεῦ Κρητῶν βουληφόρε χαλκοχιτώνωνἔρχομαι εἴ τί τοι ἔγχος ἐνὶ κλισίῃσι λέλειπταιοἰσόμενος,0,0
940,homer,iliad,ἄλλόν πού τινα μᾶλλον Ἀχαιῶν χαλκοχιτώνωνλήθω μαρνάμενος σὲ δὲ ἴδμεναι αὐτὸν ὀΐω,0,0
941,homer,iliad,οἶδ ἀρετὴν οἷός ἐσσι,0,0
942,homer,iliad,τί σε χρὴ ταῦτα λέγεσθαι,0,0
943,homer,iliad,νηυσὶ μὲν ἐν μέσσῃσιν ἀμύνειν εἰσὶ καὶ ἄλλοιΑἴαντές τε δύω Τεῦκρός θ ὃς ἄριστος Ἀχαιῶντοξοσύνῃ ἀγαθὸς δὲ καὶ ἐν σταδίῃ ὑσμίνῃ,0,0
944,homer,iliad,τῶν δ ὁμὸν ἵστατο νεῖκος ἐπὶ πρυμνῇσι νέεσσιν,0,0
945,homer,iliad,ἔφριξεν δὲ μάχη φθισίμβροτος ἐγχείῃσιμακρῇς ἃς εἶχον ταμεσίχροας,0,1
946,homer,iliad,μάλα κεν θρασυκάρδιος εἴηὃς τότε γηθήσειεν ἰδὼν πόνον οὐδ ἀκάχοιτο,0,0
947,homer,iliad,ἀλλ ὃ μὲν ἄντα ἰδὼν ἠλεύατο χάλκεον ἔγχοςἸδομενεύς,0,0
948,homer,iliad,κρύφθη γὰρ ὑπ ἀσπίδι πάντοσ ἐΐσῃτὴν ἄρ ὅ γε ῥινοῖσι βοῶν καὶ νώροπι χαλκῷδινωτὴν φορέεσκε δύω κανόνεσσ ἀραρυῖαν,0,0
949,homer,iliad,τῇ ὕπο πᾶς ἐάλη τὸ δ ὑπέρπτατο χάλκεον ἔγχοςκαρφαλέον δέ οἱ ἀσπὶς ἐπιθρέξαντος ἄϋσενἔγχεος,0,0
950,homer,iliad,Δηΐφοβος δ ἔκπαγλον ἐπεύξατο μακρὸν ἀΰσας,0,0
951,homer,iliad,οὔτε γὰρ ἐξοπίσω φυγέειν δύνατ οὔτ ἀλέασθαιἀλλ ὥς τε στήλην ἢ δένδρεον ὑψιπέτηλονἀτρέμας ἑσταότα στῆθος μέσον οὔτασε δουρὶἥρως Ἰδομενεύς ῥῆξεν δέ οἱ ἀμφὶ χιτῶναχάλκεον ὅς οἱ πρόσθεν ἀπὸ χροὸς ἤρκει ὄλεθρον,0,0
952,homer,iliad,ἀλλ ἕπευ Ἀλκαθόῳ ἐπαμύνομεν ὅς σε πάρος γεγαμβρὸς ἐὼν ἔθρεψε δόμοις ἔνι τυτθὸν ἐόντα,0,0
953,homer,iliad,ὀφθαλμὼ δ ἄρα οἱ πυρὶ λάμπετον,0,0
954,homer,iliad,ὣς μένεν Ἰδομενεὺς δουρικλυτός οὐδ ὑπεχώρειΑἰνείαν ἐπιόντα βοηθόον,0,0
955,homer,iliad,ὣς ἔφαθ οἳ δ ἄρα πάντες ἕνα φρεσὶ θυμὸν ἔχοντεςπλησίοι ἔστησαν σάκε ὤμοισι κλίναντες,0,0
956,homer,iliad,ὣς Αἰνείᾳ θυμὸς ἐνὶ στήθεσσι γεγήθειὡς ἴδε λαῶν ἔθνος ἐπισπόμενον ἑοῖ αὐτῷ,0,0
957,homer,iliad,δύο δ ἄνδρες ἀρήϊοι ἔξοχον ἄλλωνΑἰνείας τε καὶ Ἰδομενεὺς ἀτάλαντοι Ἄρηϊἵεντ ἀλλήλων ταμέειν χρόα νηλέϊ χαλκῷ,0,0
958,homer,iliad,ἣ μὲν ἀποπλαγχθεῖσα χαμαὶ πέσε καί τις Ἀχαιῶνμαρναμένων μετὰ ποσσὶ κυλινδομένην ἐκόμισσε,0,0
959,homer,iliad,ὃ δ ὑπ ἀσπίδος εἵλετο καλὴνἀξίνην εὔχαλκον ἐλαΐνῳ ἀμφὶ πελέκκῳμακρῷ ἐϋξέστῳ,0,0
960,homer,iliad,λείψετέ θην οὕτω γε νέας Δαναῶν ταχυπώλωνΤρῶες ὑπερφίαλοι δεινῆς ἀκόρητοι ἀϋτῆςἄλλης μὲν λώβης τε καὶ αἴσχεος οὐκ ἐπιδευεῖςἣν ἐμὲ λωβήσασθε κακαὶ κύνες οὐδέ τι θυμῷΖηνὸς ἐριβρεμέτεω χαλεπὴν ἐδείσατε μῆνινξεινίου ὅς τέ ποτ ὔμμι διαφθέρσει πόλιν αἰπήν,0,0
961,homer,iliad,ὣς εἰπὼν τὰ μὲν ἔντε ἀπὸ χροὸς αἱματόεντασυλήσας ἑτάροισι δίδου Μενέλαος ἀμύμωναὐτὸς δ αὖτ ἐξ αὖτις ἰὼν προμάχοισιν ἐμίχθη,0,0
962,homer,iliad,ξεῖνος γάρ οἱ ἔην πολέσιν μετὰ Παφλαγόνεσσι,0,0
