,author,text,line,expected,result
1698,polybius,histories,καὶ γὰρ ὥσπερ ἐπιμετρούσης καὶ συνεπαγωνιζομένης τοῖς γεγονόσι τῆς τύχης συνέβη μετ ὀλίγας ἡμέρας τοῦ φόβου κατέχοντος τὴν πόλιν καὶ τὸν εἰς τὴν Γαλατίαν στρατηγὸν ἀποσταλέντ εἰς ἐνέδραν ἐμπεσόντα παραδόξως ἄρδην ὑπὸ τῶν Κελτῶν διαφθαρῆναι μετὰ τῆς δυνάμεως,1,1
1699,polybius,histories,ἐξ οὗ συμβαίνει τοῖς μὲν αὐτοὺς ἡμᾶς παραγεγονέναι τὰ δὲ παρὰ τῶν ἑωρακότων ἀκηκοέναι,1,1
1700,polybius,histories,καὶ τοῦτ οὐκ ἐλάνθανε τὸν Δωρίμαχον,1,1
1701,polybius,histories,ἅπαντα δ ἐν ἐλάττονι θέμενοι τῆς σφετέρας πλεονεξίας ἀδεῶς ἐπόρθουν οὐ τολμώντων ἐπεξιέναι καθόλου τῶν Μεσσηνίων,1,1
1702,polybius,histories,ἁθροισθέντων δὲ τῶν ἐν ταῖς ἡλικίαις μετὰ τῶν ὅπλων εἰς τὴν Μεγάλην πόλιν κατὰ δόγμα τῶν Ἀχαιῶν   ἀπὸ γὰρ τούτων παρεξέβημεν  καὶ τῶν Μεσσηνίων αὖθις ἐπιπορευθέντων ἐπὶ τὸ πλῆθος καὶ δεομένων μὴ περιιδεῖν σφᾶς οὕτω προφανῶς παρασπονδουμένους βουλομένων δὲ καὶ τῆς κοινῆς συμμαχίας μετασχεῖν καὶ σπευδόντων ὁμοῦ τοῖς ἄλλοις ἐπιγραφῆναι  περὶ μὲν τῆς συμμαχίας οἱ προεστῶτες τῶν Ἀχαιῶν ἀπέλεγον οὐ φάσκοντες δυνατὸν εἶναι χωρὶς Φιλίππου καὶ τῶν συμμάχων οὐδένα προσλαβεῖν,1,1
1703,polybius,histories,οἱ δ Αἰτωλοὶ καὶ διὰ τὰς μεταξὺ δυσχωρίας  ἦσαν γὰρ ἔτι πρὸ τοῦ ποταμοῦ τάφροι καὶ πλείους δύσβατοι  καὶ διὰ τὴν ἐπίφασιν τῆς ἑτοιμότητος τῶν Ἀχαιῶν πρὸς τὸν κίνδυνον τοῦ μὲν ἐγχειρεῖν τοῖς ὑπεναντίοις κατὰ τὴν ἐξ ἀρχῆς πρόθεσιν ἀπεδειλίασαν  μετὰ δὲ πολλῆς εὐταξίας ἐποιοῦντο τὴν πορείαν ὡς ἐπὶ τὰς ὑπερβολὰς ἐπὶ τὸν Ὀλύγυρτον ἀσμενίζοντες εἰ μή τις αὐτοῖς ἐγχειροίη καὶ βιάζοιτο κινδυνεύειν,1,1
1704,polybius,histories,τὴν μὲν οὖν αἰτίαν καὶ τὴν ἀφορμὴν ὁ συμμαχικὸς πόλεμος ἔσχεν ἐκ τούτων τὴν δ ἀρχὴν ἐκ τοῦ μετὰ ταῦτα γενομένου δόγματος ἁπάντων τῶν συμμάχων,1,1
1705,polybius,histories,διὸ καὶ τῶν ἀντιπολιτευομένων κατηγορούντων αὐτοῦ καὶ φερόντων ἀπολογισμοὺς ἐναργεῖς ἔτι μᾶλλον ἠγανάκτει καὶ παρωξύνετο τὸ πλῆθος,1,1
1706,polybius,histories,πρὸς αὐτοὺς δὲ τοὺς Ἀχαιούς ἐὰν μὲν ἀφιστῶνται τῆς τῶν Μεσσηνίων συμμαχίας ἄγειν ἐψηφίσαντο τὴν εἰρήνην εἰ δὲ μή πολεμεῖν πρᾶγμα πάντων ἀλογώτατον,1,1
1707,polybius,histories,ἀρίστων δ ὁ τῶν Αἰτωλῶν στρατηγός οὐ προσποιούμενος οὐδὲν τῶν γινομένων ἦγε τὴν ἡσυχίαν ἐπὶ τῆς οἰκείας φάσκων οὐ πολεμεῖν τοῖς Ἀχαιοῖς ἀλλὰ διατηρεῖν τὴν εἰρήνην εὔηθες καὶ παιδικὸν πρᾶγμα ποιῶν,1,1
1708,polybius,histories,συνέβαινε δὲ τοὺς Κυναιθεῖς ὄντας Ἀρκάδας ἐκ πολλῶν χρόνων ἐν ἀκαταπαύστοις καὶ μεγάλαις συνεσχῆσθαι στάσεσι καὶ πολλὰς μὲν κατ ἀλλήλων πεποιῆσθαι σφαγὰς καὶ φυγάς πρὸς δὲ τούτοις ἁρπαγὰς ὑπαρχόντων  ἔτι δὲ γῆς ἀναδασμούς τέλος δ ἐπικρατῆσαι τοὺς τὰ τῶν Ἀχαιῶν αἱρουμένους καὶ κατασχεῖν τὴν πόλιν φυλακὴν ἔχοντας τῶν τειχῶν καὶ στρατηγὸν τῆς πόλεως ἐξ Ἀχαΐας,1,1
1709,polybius,histories,οἱ δὲ Λουσιᾶται νουνεχῶς δόντες τινὰ τῶν κατασκευασμάτων τῆς θεοῦ παρῃτήσαντο τὴν τῶν Αἰτωλῶν ἀσέβειαν τοῦ μηδὲν παθεῖν ἀνήκεστον,1,1
1710,polybius,histories,οὐ γὰρ ἡγητέον μουσικήν  ὡς Ἔφορός φησιν ἐν τῷ προοιμίῳ τῆς ὅλης πραγματείας οὐδαμῶς ἁρμόζοντα λόγον αὑτῷ ῥίψας ἐπ ἀπάτῃ καὶ γοητείᾳ παρεισῆχθαι τοῖς ἀνθρώποις  οὐδὲ τοὺς παλαιοὺς Κρητῶν καὶ Λακεδαιμονίων αὐλὸν καὶ ῥυθμὸν εἰς τὸν πόλεμον ἀντὶ σάλπιγγος εἰκῇ νομιστέον εἰσαγαγεῖν  οὐδὲ τοὺς πρώτους Ἀρκάδων εἰς τὴν ὅλην πολιτείαν τὴν μουσικὴν παραλαβεῖν ἐπὶ τοσοῦτον ὥστε μὴ μόνον παισὶν οὖσιν ἀλλὰ καὶ νεανίσκοις γενομένοις ἕως τριάκοντ ἐτῶν κατ ἀνάγκην σύντροφον ποιεῖν αὐτήν τἄλλα τοῖς βίοις ὄντας αὐστηροτάτους,1,1
1711,polybius,histories,μετὰ δὲ ταῦτα τοὺς Φιλοξένου καὶ Τιμοθέου νόμους μανθάνοντες πολλῇ φιλοτιμίᾳ χορεύουσι κατ ἐνιαυτὸν τοῖς Διονυσιακοῖς αὐληταῖς ἐν τοῖς θεάτροις οἱ μὲν παῖδες τοὺς παιδικοὺς ἀγῶνας οἱ δὲ νεανίσκοι τοὺς τῶν ἀνδρῶν λεγομένους,1,1
1712,polybius,histories,οὕτως γὰρ μόνως ἂν λήξαιεν τῆς τότε περὶ αὐτοὺς γενομένης ἀγριότητος,1,1
1713,polybius,histories,ταχὺ δὲ διὰ τὸ παράδοξον ἁθροισθέντων δυσαρεστῶν Ἀδείμαντος τοῖς γινομένοις ἐπειρᾶτο προπορευθεὶς παρακαλεῖν καὶ διδάσκειν διότι   πρῴην ἔδει τὰ κηρύγματα ταῦτα καὶ τοὺς ἁθροισμοὺς τοὺς ἐν τοῖς ὅπλοις παραγγέλλειν καθ ὃν καιρὸν τοὺς Αἰτωλοὺς πολεμίους ὄντας ἠκούομεν τοῖς ὅρους τῆς χώρας ἡμῶν συνεγγίζειν οὐ νῦν ὅτε Μακεδόνας τοὺς εὐεργέτας καὶ σωτῆρας πυνθανόμεθα πλησιάζειν μετὰ τοῦ βασιλέως,1,1
1714,polybius,histories,ἀλλ ἡμῖν μὲν καθήκει τοῖς γράφουσι τὰς κυρούσας τὰ διαβούλια γνώμας ἀνατιθέναι τοῖς προεστῶσι τῶν ὅλων,1,1
1715,polybius,histories,εἰ δ ὑπειλήφασι  διότι χωρὶς κοινοῦ δόγματος λεηλατοῦσι καὶ πορθοῦσι πάντας οὐκ ἀμύνεσθαι τοὺς ἀδικουμένους ἐὰν δ ἀμύνωνται νομισθήσεσθαι τούτους κατάρχειν τοῦ πολέμου πάντων αὐτοὺς εὐηθεστάτους εἶναι,1,1
1716,polybius,histories,δῆλον δ ἔσται τὸ λεγόμενον ἐκ τούτων,1,1
1717,polybius,histories,καθ οὓς γὰρ καιρούς τῆς περὶ Μαντίνειαν μάχης τῶν Ἑλλήνων ἀμφιδήριτον ἐχούσης τὴν νίκην διὰ τὸν Ἐπαμινώνδου θάνατον ἐκώλυον Λακεδαιμόνιοι μετέχειν τῶν σπονδῶν Μεσσηνίους ἀκμὴν σφετεριζόμενοι ταῖς ἐλπίσι τὴν Μεσσηνίαν  ἐπὶ τοσοῦτο διέσπευσαν Μεγαλοπολῖται καὶ πάντες οἱ κοινωνοῦντες Ἀρκάδων τῆς αὐτῶν συμμαχίας ὥστε Μεσσηνίους μὲν ὑπὸ τῶν συμμάχων προσδεχθῆναι καὶ μετασχεῖν τῶν ὅρκων καὶ διαλύσεων Λακεδαιμονίους δὲ μόνους ἐκσπόνδους γενέσθαι τῶν Ἑλλήνων,1,1
1718,polybius,histories,τὸν δὲ συνέβαινε βεβασιλευκέναι καθ οὓς καιροὺς ἐξέπεσε Λεωνίδης ἐκ τῆς ἀρχῆς διὰ τὸ κατὰ γένος ὑπάρχειν ἔγγιστα τῆς οἰκίας ταύτης,1,1
1719,polybius,histories,ὑπὲρ ὧν ἐν τῇ προτέρᾳ βύβλῳ δεδηλώκαμεν,1,1
1720,polybius,histories,ἐπεὶ δὲ παρὰ τοῖς πλείστοις ἀγνοεῖσθαι συνέβαινε τὴν ἰδιότητα καὶ τὴν εὐφυΐαν τοῦ τόπου διὰ τὸ μικρὸν ἔξω κεῖσθαι τῶν ἐπισκοπουμένων μερῶν τῆς οἰκουμένης  βουλόμεθα δὲ πάντες εἰδέναι τὰ τοιαῦτα καὶ μάλιστα μὲν αὐτόπται γίνεσθαι τῶν ἐχόντων παρηλλαγμένον τι καὶ διαφέρον τόπων εἰ δὲ μὴ τοῦτο δυνατόν ἐννοίας γε καὶ τύπους ἔχειν ἐν αὑτοῖς ὡς ἔγγιστα τῆς ἀληθείας  ῥητέον ἂν εἴη τί τὸ συμβαῖνόν ἐστι καὶ τί τὸ ποιοῦν τὴν τηλικαύτην καὶ τοιαύτην εὐπορίαν τῆς προειρημένης πόλεως,1,1
1721,polybius,histories,ἐκεῖθεν δὲ πάλιν οἷον ἐξ ὑποστροφῆς τὴν ἀνταπόδοσιν ποιεῖται πρὸς τὰ περὶ τὰς Ἑστίας ἄκρα καλούμενα τῆς Εὐρώπης,1,1
1722,polybius,histories,ἔχοντες γὰρ χώραν γενναιοτάτην ὅταν διαπονήσωσι ταύτην καὶ γένηται τὸ τῶν καρπῶν πλῆθος τῷ κάλλει διαφέρον κἄπειτα παραγενηθέντες οἱ βάρβαροι τοὺς μὲν καταφθείρωσι τοὺς δὲ συναθροίσαντες ἀποφέρωσι  τότε δὴ χωρὶς τῶν ἔργων καὶ τῆς δαπάνης καὶ τὴν καταφθορὰν θεώμενοι διὰ τὸ κάλλος τῶν καρπῶν σχετλιάζουσι καὶ βαρέως φέρουσι τὸ συμβαῖνον,1,1
1723,polybius,histories,πρός τε γὰρ Ἄτταλον καὶ πρὸς Ἀχαιὸν ἔπεμπον πρέσβεις δεόμενοι σφίσι βοηθεῖν,1,1
1724,polybius,histories,τῶν γὰρ καιρῶν παρόντων αὐτῷ καὶ τῆς τῶν ὄχλων ὁρμῆς συνεργούσης εἰς τὸ διάδημα περιθέσθαι τοῦτο μὲν οὐ προείλετο ποιῆσαι τηρῶν δὲ τὴν βασιλείαν Ἀντιόχῳ τῷ νεωτέρῳ τῶν υἱῶν ἐνεργῶς ἐπιπορευόμενος ἀνεκτᾶτο τὴν ἐπὶ τάδε τοῦ Ταύρου πᾶσαν,1,1
1725,polybius,histories,τὸ μὲν οὖν πρῶτον ἐπολέμουν πάντες οἱ Κρηταιεῖς τοῖς Λυττίοις,1,1
1726,polybius,histories,πάνυ γὰρ ἐν βραχεῖ χρόνῳ τειχήρεις καταστήσαντες τούς τ Ἐλευθερναίους καὶ Κυδωνιάτας ἔτι δὲ τοὺς Ἀπτεραίους ἠνάγκασαν ἀποστάντας τῆς τῶν Κνωσίων συμμαχίας κοινωνῆσαι σφίσι τῶν αὐτῶν ἐλπίδων,1,1
1727,polybius,histories,διόπερ ἀγωνιῶντες οἱ Σινωπεῖς μήποτε κατὰ τὴν ἀπὸ τῆς Ἀσίας πλευρὰν ὁ Μιθριδάτης συστησάμενος ἔργα καὶ κατὰ τὴν ἀπέναντι ταύτης ὁμοίως ποιησάμενος ἀπόβασιν κατὰ θάλατταν εἰς τοὺς ὁμαλοὺς καὶ τοὺς ὑπερκειμένους τῆς πόλεως τόπους ἐγχειρήσῃ πολιορκεῖν αὐτούς  ἐπεβάλοντο τῆς χερρονήσου κύκλῳ τὸ νησίζον ὀχυροῦν ἀποσταυροῦντες καὶ περιχαρακοῦντες τὰς ἐκ θαλάττης προσβάσεις ἅμα δὲ καὶ βέλη καὶ στρατιώτας τιθέντες ἐπὶ τοὺς εὐκαίρους τῶν τόπων,1,1
1728,polybius,histories,περιστρατοπεδεύσας δὲ τὴν προειρημένην πόλιν καὶ προσβολὰς ἐνεργοὺς καὶ καταπληκτικὰς ἐπὶ δύ ἡμέρας ποιησάμενος παρέλαβε καθ ὁμολογίαν ἀφεὶς ὑποσπόνδους τοὺς ἐνόντας τῶν Αἰτωλῶν,1,1
1729,polybius,histories,παραπλησίως δὲ καὶ τοὺς λοιποὺς πύργους τοὺς κατὰ τὴν χώραν ἐπέταξε τοῖς προνομεύουσικαταφέρειν,1,1
1730,polybius,histories,Ῥωμαῖοι δέ προσπεσούσης αὐτοῖς τῆς Ζακανθαίων ἁλώσεως πρεσβευτὰς ἔπεμπον ἐξαιτήσοντας Ἀννίβαν παρὰ Καρχηδονίων ἅμα δὲ πρὸς τὸν πόλεμον παρεσκευάζοντο καταστήσαντες ὑπάτους Πόπλιον Κορνήλιον καὶ Τεβέριον Σεμπρώνιον,1,1
1731,polybius,histories,κατὰ δὲ τοὺς αὐτοὺς καιροὺς Εὐριπίδας ἔχων Ἠλείων δύο λόχους μετὰ τῶν πειρατῶν καὶ μισθοφόρων ὥστ εἶναι τοὺς πάντας εἰς δισχιλίους καὶ διακοσίους ἅμα δὲ τούτοις ἱππεῖς ἑκατόν ὁρμήσας ἐκ Ψωφῖδος ἐποιεῖτο τὴν πορείαν διὰ τῆς Φενικῆς καὶ Στυμφαλίας οὐδὲν μὲν εἰδὼς τῶν κατὰ τὸν Φίλιππον βουλόμενος δὲ κατασῦραι τὴν τῶν Σικυωνίων χώραν,1,1
1732,polybius,histories,ὁ δὲ βασιλεύς οὐδὲν εἰδὼς τῶν περὶ τοὺς ὑπεναντίους κατὰ δὲ τὴν αὑτοῦ πρόθεσιν ἀναζεύξας τὴν ἑωθινὴν προῆγε κρίνων ποιεῖσθαι τὴν πορείαν παρ αὐτὸν τὸν Στύμφαλον ὡς ἐπὶ τὰς Καφύας,1,1
1733,polybius,histories,ἅμα δὲ τῷ προσάγοντας αὐτοῖς τοὺς Μακεδόνας σύνεγγυς γενέσθαι λαβόντες ἔννοιαν τοῦ κατ ἀλήθειαν ὄντος πάντες ὥρμησαν πρὸς φυγήν ῥίψαντες τὰ ὅπλα,1,1
1734,polybius,histories,θύσας δὲ τῷ θεῷ καὶ τοὺς ἡγεμόνας ἑστιάσας ἅμα δὲ καὶ τὴν λοιπὴν προσαναπαύσας δύναμιν ἐπὶ τρεῖς ἡμέρας μετὰ ταῦτα πάλιν ἀνέζευξε,1,1
1735,polybius,histories,ἔνιοι γὰρ αὐτῶν οὕτως στέργουσι τὸν ἐπὶ τῶν ἀγρῶν βίον ὥστε τινὰς ἐπὶ δύο καὶ τρεῖς γενεάς ἔχοντας ἱκανὰς οὐσίας μὴ παραβεβληκέναι τὸ παράπαν εἰς ἁλίαν,1,1
1736,polybius,histories,τὸ μὲν οὖν πρῶτον ἐπέτρεψε τοῖς Μακεδόσιν ἐκβαλεῖν ἐκ τῶν σταθμῶν ἀεὶ τοὺς προκατέχοντας τῶν Ἀχαιῶν καταλύσεις ὁμοίως δὲ καὶ τὴν λείαν ἀφαιρεῖσθαι,1,1
1737,polybius,histories,ὁρῶν δὲ τό τε πολισμάτιον τοὺς Πρόννους δυσπολιόρκητον ὂν καὶ τὴν χώραν στενήν παρέπλει τῷ στόλῳ καὶ καθωρμίσθη πρὸς τὴν τῶν Παλαιῶν πόλιν,1,1
1738,polybius,histories,τῆς γὰρ τῶν Φιαλέων πόλεως ἐξαιρεθείσης ἀπροφασίστως τὸ λοιπὸν ἤδη μετεῖχον Μεσσήνιοι τοῦ πολέμου,1,1
1739,polybius,histories,τῶν δ Αἰτωλῶν τοὺς μὲν ἡμίσεις ἔχων Δωρίμαχος ἐπεποίητο τὴν ἔξοδον καθάπερ εἶπον τοὺς δ ἡμίσεις ἀπολελοίπει νομίζων ἀξιόχρεων πρὸς τὰ παράδοξα ταύτην τὴν ἐφεδρείαν ὑπάρχειν τῶν τε πόλεων καὶ τῆς χώρας,1,1
1740,polybius,histories,νόμους καλῶς καὶ δικαίως ἐπράττετο,1,1
1741,polybius,histories,τὰ δὲ μετὰ ταῦτα πῶς χρὴ λέγειν οὐκ οἶδα,1,1
1742,polybius,histories,εἰς δὲ τὴν ὑστεραίαν κατασκάψας τὴν Μέταπαν προῆγε καὶ παρενέβαλε περὶ τὴν καλουμένην πόλιν Ἄκρας,1,1
1743,polybius,histories,ἐπυνθάνετο γὰρ εἰς τὸν Στράτον συνδεδραμηκέναι τῶν Αἰτωλῶν πεζοὺς μὲν εἰς τρισχιλίους ἱππεῖς δὲ περὶ τετρακοσίους Κρῆτας δ εἰς πεντακοσίους,1,1
1744,polybius,histories,ὁ δὲ Φίλιππος τῇ μὲν πρώτῃ κατεστρατοπέδευσε περὶ τὰς Ἀμύκλας,1,1
1745,polybius,histories,μεταβαλόμενος δ αὖτις ἐποιεῖτο τὴν πορείαν παρὰ τὸν ναύσταθμον τῶν Λακεδαιμονίων ὃ καλεῖται μὲν Γύθιον ἔχει δ ἀσφαλῆ λιμένα τῆς δὲ πόλεως ἀπέχει περὶ διακόσια καὶ τριάκοντα στάδια,1,1
1746,polybius,histories,ἐμεμηχάνηντο δέ τι πρὸς τοῖς ὑπάρχουσι καὶ τοιοῦτον οἱ Λακεδαιμόνιοι,1,1
1747,polybius,histories,διόπερ τὸ μὲν πρῶτον ἐντεύξεις ἐποιεῖτο παρακαλῶν μετὰ χορηγίας τῆς καθηκούσης καὶ δυνάμεως αὐτὸν ἐκπέμψαι  μετὰ δὲ ταῦτα παρακουόμενος ἠξίου μετὰ δεήσεως μόνον αὐτὸν ἀπολῦσαι μετὰ τῶν ἰδίων οἰκετῶν,1,1
1748,polybius,histories,ἢ δῆλον ἔφη τοὺς ἀπὸ Συρίας καὶ Καρίας στρατιώτας,1,1
1749,polybius,histories,καθ ὃν δὲ καιρὸν Ἀρχίδαμος ἐκ τῆς Σπάρτης ἔφυγε δείσας τὸν Κλεομένην καὶ παρεγένετ εἰς Μεσσηνίαν οὐ μόνον οἰκίᾳ καὶ τοῖς ἄλλοις ἀναγκαίοις ὁ Νικαγόρας αὐτὸν ἐδέξατο προθύμως ἀλλὰ καὶ κατὰ τὴν ἑξῆς συμπεριφορὰν ἐγένετό τις αὐτοῖς ὁλοσχερὴς εὔνοια καὶ συνήθεια πρὸς ἀλλήλους,1,1
1750,polybius,histories,πρὸς μὲν οὖν τοὺς ἐκτὸς ὁ Νικαγόρας ὑπεκρίνετο χάριν ὀφείλειν τῷ Κλεομένει διὰ τὴν αὑτοῦ σωτηρίαν ἐν αὑτῷ γε μὴν βαρέως ἔφερε τὸ συμβεβηκός δοκῶν αἴτιος γεγονέναι τῷ βασιλεῖ τῆς ἀπωλείας,1,1
1751,polybius,histories,ἰδὼν δ ὁ Κλεομένης αὐτὸν καὶ συμμίξας ἠσπάζετο φιλοφρόνως καὶ προσεπύθετο τί παρείη,1,1
1752,polybius,histories,εἰς ἃ βλέπων ὁ Κλεομένης καὶ μοχθηρὰς ἐλπίδας ἔχων ὑπὲρ τοῦ μέλλοντος παντὸς πράγματος ἔκρινε πεῖραν λαμβάνειν  οὐχ οὕτως πεπεισμένος κατακρατήσειν τῆς προθέσεως  οὐδὲν γὰρ εἶχε τῶν εὐλόγων πρὸς τὴν ἐπιβολήν  τὸ δὲ πλεῖον εὐθανατῆσαι σπουδάζων καὶ μηδὲν ἀνάξιον ὑπομεῖναι τῆς περὶ αὐτὸν προγεγενημένης τόλμης  ἅμα δὲ καὶ λαμβάνων ἐν νῷ τὸ τοιοῦτον ὥς γ ἐμοὶ δοκεῖ καὶ προτιθέμενος ὅπερ εἴωθε συμβαίνειν πρὸς τοὺς μεγαλόφρονας τῶν ἀνδρῶνμὴ μὰν ἀσπουδεί γε καὶ ἀκλειῶς ἀπολοίμηνἀλλὰ μέγα ῥέξας τι καὶ ἐσσομένοισι πυθέσθαι,1,1
1753,polybius,histories,ἀποσφαλέντες δὲ καὶ ταύτης τῆς ἐπιβολῆς διὰ τὸ τοὺς ἐφεστῶτας προαισθομένους τὸ μέλλον ἀσφαλίσασθαι τὴν πύλην προσήνεγκαν αὑτοῖς τὰς χεῖρας εὐψύχως πάνυ καὶ Λακωνικῶς,1,1
1754,polybius,histories,ὢν δὲ ταύτης τῆς προθέσεως ἐπεῖχε βουλόμενος ἀεί τινος ὁρμῆς ἐπιλαβέσθαι καὶ προφάσεως κατὰ τοῦ προειρημένου,1,1
1755,polybius,histories,αὐτὴ δ ἡ Μηδία διέζευκται πλείοσιν ὄρεσιν ἀπὸ τῆς ἠοῦς ἕως πρὸς τὰς δύσεις ὧν μεταξὺ κεῖται πεδία πληθύοντα πόλεσι καὶ κώμαις,1,1
1756,polybius,histories,ἐπιλέξας δ ἐκ παντὸς τοῦ στρατεύματος τοὺς εὐρωστοτάτους ἱππεῖς καὶ πεζούς ἐπὶ τῆς παρεμβολῆς ἀπολιπὼν Ζεῦξιν καὶ Πυθιάδην παρῆλθε νυκτὸς ὡς ὀγδοήκοντα σταδίους ὑποκάτω τῆς τοῦ Μόλωνος στρατοπεδείας  καὶ διακομίσας τοῖς πλοίοις τὴν δύναμιν ἀσφαλῶς νυκτὸς ἔτι κατεστρατοπέδευσε λαβὼν εὐφυῆ τόπον ᾧ συνέβαινε κατὰ μὲν τὸ πλεῖστον ὑπὸ τοῦ ποταμοῦ περιέχεσθαιτὸ δὲ λοιπὸν ἕλεσιν ἠσφαλίσθαι καὶ τέλμασιν,1,1
1757,polybius,histories,διὸ καὶ ταύτης μὲν τῆς ἐπιβολῆς ἀπέστη καταλιπὼν δὲ τοὺς πολιορκήσοντας κατὰ τάχος ἀνέζευξε καὶ κατῆρε μετὰ τῆς δυνάμεως πάλιν εἰς Σελεύκειαν τὴν ἐπὶ τῷ Τίγριδι,1,1
1758,polybius,histories,τέλος δὲ μάχῃ κρατηθέντες ὑπό τινος τῶν τοῦ βασιλέως στρατηγῶν οἱ μὲν πλεῖστοι διεφθάρησαν οἱ δὲ περιλειφθέντες παρέδοσαν ἑαυτοὺς εἰς τὴν τοῦ βασιλέως πίστιν,1,1
1759,polybius,histories,ἐπὶ μὲν οὖν τοῦ δεξιοῦ κέρως ἔταξε πρώτους τοὺς ξυστοφόρους ἱππεῖς ἐπιστήσας Ἄρδυν κεκριμένον ἄνδρα περὶ τὰς πολεμικὰς πράξεις,1,1
1760,polybius,histories,Μόλων δὲ δύσχρηστον μὲν ἐποιήσατο τὴν ἐξαγωγήν  ταραχώδη δὲ καὶ τὴν ἔκταξιν διὰ τὴν ἐν τῇ νυκτὶ προγεγενημένην ἀλογίαν,1,1
1761,polybius,histories,οὐ μὴν ἀλλὰ τοὺς μὲν ἱππεῖς ἐφ ἑκάτερον ἐμερίσατο κέρας στοχαζόμενος τῆς τῶν ὑπεναντίων παρατάξεως τοὺς δὲ θυρεαφόρους καὶ Γαλάτας καὶ καθόλου τὰ βαρέα τῶν ὅπλων εἰς τὸν μεταξὺ τόπον ἔθηκε τῶν ἱππέων,1,1
1762,polybius,histories,μετὰ ταῦτα δὲ ταῖς δυνάμεσιν ἐπιτιμήσας διὰ πλειόνων καὶ δοὺς δεξιὰν συνέστησε τοὺς ἀποκομιοῦντας αὐτοὺς εἰς Μηδίαν καὶ καταστησομένους τὰ κατὰ τὴν χώραν,1,1
